{
  "version": "0.1",
  "contextId": "ctx_fa00867e6921f4a836c63a4e9fd87dfa",
  "title": "Weekly research briefing",
  "contextType": "crystallized",
  "layout": {
    "type": "workspace",
    "regions": [
      {
        "id": "agenda",
        "width": "one-third",
        "component": {
          "type": "checklist",
          "binding": "briefing.agenda",
          "props": {
            "title": "Reusable agenda",
            "items": [
              {
                "id": "gather",
                "label": "Gather sources published this week",
                "checked": false
              },
              {
                "id": "filter",
                "label": "Filter to the three that changed something",
                "checked": false
              },
              {
                "id": "draft",
                "label": "Draft the briefing",
                "checked": false
              },
              {
                "id": "review",
                "label": "Human review before export",
                "checked": false
              },
              {
                "id": "export",
                "label": "Export to the briefing folder",
                "checked": false
              }
            ]
          }
        }
      },
      {
        "id": "library",
        "width": "one-third",
        "component": {
          "type": "source-list",
          "binding": "briefing.library",
          "props": {
            "title": "Source library",
            "sources": [
              {
                "label": "Standing feed list",
                "kind": "note",
                "detail": "Carried forward between runs",
                "trusted": true
              },
              {
                "label": "Regulatory tracker",
                "kind": "note",
                "detail": "Checked every run",
                "trusted": true
              }
            ]
          }
        }
      },
      {
        "id": "stages",
        "width": "one-third",
        "component": {
          "type": "timeline",
          "binding": "briefing.stages",
          "props": {
            "title": "Workflow stages",
            "entries": [
              {
                "at": "Stage 1",
                "label": "Prepare workspace",
                "detail": "Create the run folder"
              },
              {
                "at": "Stage 2",
                "label": "Collect and summarize"
              },
              {
                "at": "Stage 3",
                "label": "Approval",
                "detail": "Requires a human decision"
              },
              {
                "at": "Stage 4",
                "label": "Export"
              }
            ]
          }
        }
      },
      {
        "id": "template",
        "width": "two-thirds",
        "component": {
          "type": "editor",
          "binding": "briefing.template",
          "props": {
            "title": "Briefing template",
            "value": "# Weekly research briefing — {{week}}\n\n## What changed\n\n- \n\n## Why it matters\n\n- \n\n## What to watch next week\n\n- \n\n## Sources\n\n- \n",
            "placeholder": "The briefing structure carried between runs."
          }
        }
      },
      {
        "id": "notes",
        "width": "one-third",
        "component": {
          "type": "text",
          "props": {
            "title": "What this template keeps",
            "tone": "muted",
            "body": "Layout, component choices, stages, permission defaults, instructions and named inputs. Conversation, files, secrets and execution logs from the original run were removed when this context was crystallized."
          }
        }
      }
    ]
  },
  "suggestedActions": [
    {
      "id": "run.briefing",
      "label": "Start this week’s briefing",
      "kind": "context",
      "description": "Create a new ephemeral context from this template."
    },
    {
      "id": "export.briefing",
      "label": "Export briefing",
      "kind": "system",
      "capability": "files.write"
    }
  ]
}
